Razăo Social;Fundo;Código
AD SHOPPING FUNDO DE INVESTIMENTO IMOBILIÁRIO RESPONSABILIDADE LIMITADA;FII ADSH;ADSH;
AF INVEST CRI FUNDO DE INVESTIMENTO IMOBILIÁRIO RECEBÍVEIS IMOBILIÁRIOS RESPONSABILIDADE LIMITADA;FII AFHI CRI;AFHI;
AF INVEST REAL ESTATE MULTIESTRATÉGIA FUNDO DE INVESTIMENTO IMOBILIÁRIO - RESPONSABILIDADE LIMITADA;FII AFHF;AFHF;
AIRPORT TOWN FUNDO DE INVESTIMENTO IMOBILIARIO - FII;FII A TOWN;ATWN;
AJ MALLS FUNDO DE INVESTIMENTO IMOBILIÁRIO RESPONSABILIDADE LIMITADA;FII AJ MALLS;AJFI;
ALIANZA CRÉDITO IMOBILIÁRIO FUNDO DE INVESTIMENTO IMOBILIÁRIO RESPONSABILIDADE LIMITADA;FII ALIANZAC;ALZC;
ALIANZA MULTIOFFICES - FUNDO DE INVESTIMENTO IMOBILIÁRIO - RESPONSABILIDADE LIMITADA;FII MULT OF1;MTOF;
ALIANZA TRUST RENDA IMOBILIÁRIA - FUNDO DE INVESTIMENTO IMOBILIÁRIO RESPONSABILIDADE LIMITADA;FII ALIANZA;ALZR;
ALIANZA URBAN HUB RENDA FUNDO DE INVESTIMENTO IMOBILIÁRIO RESPONSABILIDADE LIMITADA;FII ALI URB;AURB;
APEX MALLS FUNDO DE INVESTIMENTO IMOBILIÁRIO RESPONSABILIDADE LIMITADA;FII APEX MS;APXM;
APEX URB FUNDO DE INVESTIMENTO IMOBILIÁRIO RESPONSABILIDADE LIMITADA;FII APXU;APXU;
ARCH EDIFÍCIOS CORPORATIVOS FUNDO DE INVESTIMENTO IMOBILIÁRIO - RESPONSABILIDADE LIMITADA;FII AUTONOMY;AIEC;
ARCH VANGUARDA UNIDADES RESIDENCIAIS FUNDO DE INVESTIMENTO IMOBILIÁRIO RESPONSABILIDADE LIMITADA;FII AVUR;AVUR;
AROEIRA 333 RENDA LOGÍSTICA FUNDO DE INVESTIMENTO IMOBILIÁRIO RESPONSABILIDADE LIMITADA;FII AROA;AROA;
AROEIRA FUNDO DE INVESTIMENTO IMOBILIÁRIO - RESPONSABILIDADE LIMITADA;FII EIRA;EIRA;
ÁRTEMIS FUNDO DE INVESTIMENTO IMOBILIÁRIO RESPONSABILIDADE LIMITADA;FII ARTE;ARTE;
ARX DOVER RECEBÍVEIS FUNDO DE INVESTIMENTO IMOBILIÁRIO DE RESPONSABILIDADE LIMITADA;FII ARXD R;ARXD;
AZ QUEST PANORAMA CRÉDITO ESTRUTURADO FUNDO DE INVESTIMENTO IMOBILIÁRIO DE RESPONSABILIDADE LIMITADA;FII AZPE;AZPE;
AZ QUEST PANORAMA LOGÍSTICA FUNDO DE INVESTIMENTO IMOBILIÁRIO - RESPONSABILIDADE LIMITADA;FII AZPL;AZPL;
AZ SOLARGRID RENDA  SOLAR FUNDO DE INVESTIMENTO IMOBILIÁRIO RESPONSABILIDADE  LIMITADA;FII AZSG;AZSG;
BALTIMORE FUNDO DE INVESTIMENTO IMOBILIÁRIO DE RESPONSABILIDADE LIMITADA;FII CEBB;CEBB;
BANESTES RECEBÍVEIS  IMOBILIÁRIOS FUNDO DE INVESTIMENTO IMOBILIÁRIO - FII - RESPONSABILIDADE LIMITAD;FII BEES CRI;BCRI;
BANRISUL NOVAS FRONTEIRAS FUNDO DE INVESTIMENTO IMOBILIARIO - RESPONSABILIDADE LIMITADA;FII BANRISUL;BNFS;
BARRA MALLS FUNDO DE INVESTIMENTO IMOBILIÁRIO;FII BR MALLS;BTML;
BARZEL CD1 FUNDO DE INVESTIMENTO IMOBILIARIO RESPONSABILIDADE LIMITADA;FII BARZEL;BZEL;
BASÍLICA PARTNERS GDR FUNDO DE INVESTIMENTO IMOBILIÁRIO FII RESPONSABILIDADE LIMITADA;FII BPDR;BPDR;
BASÍLICA PARTNERS LED CORPORATE FUNDO DE INVESTIMENTO IMOBILIÁRIO FII;FII BASILICA;BPLC;
BASÍLICA PARTNERS MEDWELL FUNDO DE INVESTIMENTO IMOBILIÁRIO FII RESPONSABILIDADE LIMITADA;FII BPMW;BPMW;
BB FUNDO DE FUNDOS - FUNDO DE INVESTIMENTO IMOBILIÁRIO RESPONSABILIDADE LIMITADA;FII BB FOF;BBFO;
BB PREMIUM MALLS FUNDO DE INVESTIMENTO IMOBILIÁRIO DE RESPONSABILIDADE LIMITADA;FII BBIG;BBIG;
BB RENDA CORPORATIVA FUNDO DE INVESTIMENTO IMOBILIÁRIO RESPONSABILIDADE LIMITADA;FII BB CORP;BBRC;
BE IN RIO FUNDO DE INVESTIMENTO IMOBILIÁRIO - RESPONSABILIDADE LIMITADA;FII BINR;BINR;
BFC FUNDO DE INVESTIMENTO IMOBILIÁRIO;FII BFCC;BFCC;
BGR B32 FUNDO DE INVESTIMENTO IMOBILIÁRIO;FII BGRB;BGRB;
BGR CIDADE JARDIM FUNDO DE INVESTIMENTO IMOBILIÁRIO - RESPONSABILIDADE LIMITADA;FII BGRJ;BGRJ;
BLUECAP LOG FUNDO DE INVESTIMENTO IMOBILIÁRIO;FII BLOG;BLOG;
BLUEMACAW FUNDO DE INVESTIMENTO IMOBILIÁRIO RESPONSABILIDADE LIMITADA;FII BLUE LOG;BLMG;
BM BRASCAN LAJES CORPORATIVAS FUNDO DE INVESTIMENTO IMOBILIÁRIO RESPONSABILIDADE LIMITADA;FII BMBRC LC;BMLC;
BR7 SENADO FUNDO DE INVESTIMENTO IMOBILIÁRIO;FII BR7 SENA;BRSE;
BRADESCO CARTEIRA IMOBILIÁRIA ATIVA - FUNDO DE FUNDOS DE INVESTIMENTO IMOBILIÁRIO - FII;FII BCIA;BCIA;
BRASIL VAREJO FUNDO DE INVESTIMENTO IMOBILIÁRIO RESPONSABILIDADE LIMITADA;FII B VAREJO;BVAR;
BRAZILIAN GRAVEYARD AND DEATH CARE SERVICES FUNDO DE INVESTIMENTO IMOBILIÁRIO - FII RESP LIMITADA;FII DEA CARE;CARE;
BRC RENDA CORPORATIVA FUNDO DE INVESTIMENTO IMOBILIÁRIO - RESPONSABILIDADE LIMITADA;FII ATHENA I;FATN;
BRC-II FUNDO DE INVESTIMENTO IMOBILIÁRIO - RESPONSABILIDADE LIMITADA;FII RTEL;RTEL;
BRC-III DESENVOLVIMENTO FUNDO DE INVESTIMENTO IMOBILIÁRIO - RESPONSABILIDADE LIMITADA;FII BRCT;BRCT;
BRESCO DESENVOLVIMENTO FUNDO DE INVESTIMENTO IMOBILIÁRIO RESPONSABILIDADE LIMITADA;FII BRCD;BRCD;
BRESCO LOGÍSTICA FUNDO DE INVESTIMENTO IMOBILIÁRIO RESPONSABILIDADE LIMITADA;FII BRESCO;BRCO;
BRIO CRÉDITO ESTRUTURADO - FUNDO DE INVESTIMENTO IMOBILIÁRIO - RESPONSABILIDADE LIMITADA;FII BRIO CRE;BICE;
BRIO MULTIESTRATÉGIA - FUNDO DE INVESTIMENTO IMOBILIÁRIO RESPONSABILIDADE LIMITADA;FII BRIO ME;BIME;
BRIO REAL ESTATE II - FUNDO DE INVESTIMENTO IMOBILIÁRIO - RESPONSABILIDADE LIMITADA;FII BRIO II;BRIM;
BRIO REAL ESTATE III - FUNDO DE INVESTIMENTO IMOBILIÁRIO - RESPONSABILIDADE LIMITADA;FII BRIO III;BRIP;
BRIO REAL ESTATE IV - FUNDO DE INVESTIMENTO IMOBILIÁRIO - RESPONSABILIDADE LIMITADA;FII BRIO IV;BIPD;
BRIO REAL ESTATE V - FUNDO DE INVESTIMENTO IMOBILIÁRIO - RESPONSABILIDADE LIMITADA;FII BRIO V;BIPE;
BRM MINHA CASA MINHA VIDA III FUNDO DE INVESTIMENTO IMOBILIÁRIO RESPONSABILIDADE LIMITADA;FII MCMV;MCMV;
BRPR CORPORATE OFFICES FUNDO DE INVESTIMENTO IMOBILIÁRIO RESPONSABILIDADE LIMITADA;FII BROF;BROF;
BRPR E-TOWER FUNDO DE INVESTIMENTO IMOBILIÁRIO;FII BETW;BETW;
BS2 ALLINVESTMENTS FUNDO DE INVESTIMENTO IMOBILIÁRIO;FII BS2;LLAO;
BTG HOSPITALIDADE RETORNO TOTAL FUNDO DE INVESTIMENTO IMOBILIÁRIO  RESPONSABILIDADE LIMITADA;FII BTHR;BTHR;
BTG HOTÉIS FUNDO DE INVESTIMENTO IMOBILIÁRIO RESPONSABILIDADE LIMITADA;BTG HOTEL FI;BTHI;
BTG PACTUAL CORPORATE OFFICE FUND - FUNDO DE INVESTIMENTO IMOBILIÁRIO RESPONSABILIDADE LIMITADA;FII BC FUND;BRCR;
BTG PACTUAL CRÉDITO IMOBILIÁRIO - FUNDO DE CRI - FI IMOBILIÁRIO RESPONSABILIDADE LIMITADA;FII BTG CRI;BTCI;
BTG PACTUAL LOGÍSTICA FUNDO DE INVESTIMENTO IMOBILIÁRIO RESPONSABILIDADE LIMITADA;FII BTLG;BTLG;
BTG PACTUAL REAL ESTATE HEDGE FUND FII - FUNDO DE INVESTIMENTO IMOBILIÁRIO RESPONSABILIDADE LIMITADA;FII BTHF;BTHF;
BTG PACTUAL SHOPPINGS FUNDO DE INVESTIMENTO IMOBILIÁRIO RESPONSABILIDADE LIMITADA;FII BTG SHOP;BPML;
BTG PACTUAL YOU INC. DESENVOLVIMENTO IMOBILIÁRIO - FUNDO DE INVESTIMENTO IMOBILIÁRIO RESPONSABILIDAD;FII BTYU;BTYU;
BTOWERS FUNDO DE INVESTIMENTO IMOBILIÁRIO RESPONSABILIDADE LIMITADA;FII BTOWERS;BTWR;
BTSP II FUNDO DE INVESTIMENTO IMOBILIÁRIO FII RESPONSABILIDADE LIMITADA;FII BTSP II;BTSI;
CAIXA IMÓVEIS CORPORATIVOS FUNDO DE INVESTIMENTO IMOBILIÁRIO - RESPONSABILIDADE LIMITADA;FII CEF CORP;CXCO;
CAIXA RIO BRAVO FUNDO DE FUNDOS DE INVESTIMENTO IMOBILIÁRIO II RESPONSABILIDADE LIMITADA;FII CX RBRA2;CRFF;
CAIXA RIO BRAVO FUNDO DE FUNDOS DE INVESTIMENTO IMOBILIARIO RESPONSABILIDADE LIMITADA;FII CX RBRAV;CXRI;
CANUMA CAPITAL MULTIESTRATÉGIA FUNDO DE INVESTIMENTO IMOBILIÁRIO RESPONSABILIDADE LIMITADA;FII CANUMA;CCME;
CANUMA CAPITAL RENDA VAREJO FUNDO DE INVESTIMENTO IMOBILIÁRIO RESPONSABILIDADE LIMITADA;FII CCVA;CCVA;
CAPITÂNIA HBC RENDA URBANA FUNDO DE INVESTIMENTO IMOBILIÁRIO RESPONSABILIDADE  LIMITADA;FII CPHBC UR;CPUR;
CAPITÂNIA LOGÍSTICA FUNDO DE INVESTIMENTO IMOBILIÁRIO - RESPONSABILIDADE LIMITADA;FII CPLG;CPLG;
CAPITÂNIA OFFICE FII - FUNDO DE INVESTIMENTO IMOBILIÁRIO;FII CPOF;CPOF;
CAPITÂNIA SECURITIES II FUNDO DE INVESTIMENTO IMOBILIÁRIO RESPONSABILIDADE LIMITADA;FII CAPI SEC;CPTS;
CAPITÂNIA SHOPPINGS FUNDO DE INVESTIMENTO IMOBILIÁRIO - RESPONSABILIDADE LIMITADA;FII CPSH;CPSH;
CARTESIA RECEBÍVEIS IMOBILIÁRIOS - FUNDO DE INVESTIMENTO IMOBILIÁRIO DE RESPONSABILIDADE LIMITADA;CARTESIA FII;CACR;
CASTELLO BRANCO OFFICE PARK - FUNDO DE INVESTIMENTO IMOBILIÁRIO - RESPONSABILIDADE LIMITADA;FII CBOP PAX;CBOP;
CATUAÍ VBI TRIPLE A FUNDO DE INVESTIMENTO IMOBILIÁRIO - RESPONSABILIDADE LIMITADA;FII BLCA VBI;BLCA;
CATUAÍ VISTA FL FUNDO DE INVESTIMENTO IMOBILIÁRIO DE RESPONSABILIDADE LIMITADA;FII CVFL;CVFL;
CENESP FUNDO DE INVESTIMENTO IMOBILIÁRIO RESPONSABILIDADE LIMITADA;FII CENESP;CNES;
CENTRAL REAL ESTATE HIGH YIELD DEBT FUNDO DE INVESTIMENTO IMOBILIÁRIO RESPONSABILIDADE LIMITADA;FII CDHY;CDHY;
CENTRO TĘXTIL INTERNACIONAL FUNDO DE INVESTIMENTO IMOBILIÁRIO DE RESPONSABILIDADE LIMITADA;FII C TEXTIL;CTXT;
CENU - FUNDO DE INVESTIMENTO IMOBILIÁRIO RESPONSABILIDADE LIMITADA;FII CENU PAX;CENU;
CF3  FUNDO DE INVESTIMENTO IMOBILIÁRIO;FII CF3 IMOB;CFII;
CIDADE JARDIM CONTINENTAL TOWER FUNDO DE INVESTIMENTO IMOBILIÁRIO DE RESPONSABILIDADE LIMITADA;FII CJCTOWER;CJCT;
CITLOG SUL DE MINAS FUNDO DE INVESTIMENTO IMOBILIÁRIO DE RESPONSABILIDADE LIMITADA;FII CLSM;CLSM;
CIX MUIRAQUITAN FUNDO DE INVESTIMENTO IMOBILIÁRIO RESPONSABILIDADE LIMITADA;FII CIXM;CIXM;
CIX RETROFIT FUNDO DE INVESTIMENTO IMOBILIÁRIO RESPONSABILIDADE LIMITADA;FII CIXF;CIXF;
CLASSE A DE COTAS DO SINAL RJDI - BRASIL MALLS FUNDO DE INVESTIMENTO IMOBILIÁRIO RESP LIMITADA;FII PDBM;PDBM;
CLAVE ÍNDICES DE PREÇOS FUNDO DE INVESTIMENTO IMOBILIÁRIO RESPONSABILIDADE LIMITADA;FII CLAVE IN;CLIN;
COSMIC FUNDO DE INVESTIMENTO IMOBILIÁRIO DE RESPONSABILIDADE LIMITADA;FII COSMIC;CSMC;
CPV ENERGIA FUNDO DE INVESTIMENTO IMOBILIÁRIO RESPONSABILIDADE LIMITADA;FII RENV;RENV;
CRI INTEGRAL BREI FUNDO DE INVESTIMENTO IMOBILIÁRIO RESPONSABILIDADE LIMITADA;FII BREI;IBCR;
CVPAR FUNDO DE INVESTIMENTO IMOBILIÁRIO DE CRI RESPONSABILIDADE LIMITADA;FII CVPAR;CVPR;
CYRELA CRÉDITO - FUNDO DE INVESTIMENTO IMOBILIÁRIO - RESPONSABILIDADE LIMITADA;FII CYRELA;CYCR;
CYRELA DESENVOLVIMENTO LOGÍSTICO FUNDO DE INVESTIMENTO IMOBILIÁRIO RESPONSABILIDADE LIMITADA;FII CYLD;CYLD;
DAMA FUNDO DE INVESTIMENTO IMOBILIÁRIO RESPONSABILIDADE LIMITADA;FII DAMA;DAMA;
DAYCOVAL REAL ESTATE MULTIESTRATÉGIA FUNDO DE INVESTIMENTO IMOBILIÁRIO DE RESPONSABILIDADE LIMITADA;FII DAYC REM;DAYM;
DAYCOVAL RETROFITS I FUNDO DE INVESTIMENTO IMOBILIÁRIO RESPONSABILIDADE LIMITADA;FII ASA RET;ASRF;
DEL MONTE AJAX FUNDO DE INVESTIMENTO IMOBILIÁRIO - FII DE RESPONSABILIDADE LIMITADA;FII DEL MONT;DLMT;
DEVANT PROPERTIES FUNDO DE INVESTIMENTO IMOBILIÁRIO DE RESPONSABILIDADE LIMITADA;FII DEVA PRO;DPRO;
DEVANT RECEBÍVEIS IMOBILIÁRIOS FUNDO DE INVESTIMENTO IMOBILIÁRIO;FII DEVANT;DEVA;
DIAMANTE FUNDO DE INVESTIMENTO IMOBILIÁRIO RESPONSABILIDADE LIMITADA;FII DIAMANTE;DAMT;
DOVEL FUNDO DE INVESTIMENTO IMOBILIÁRIO - RESPONSABILIDADE LIMITADA;FII DOVEL;DOVL;
EDGE FUNDO DE INVESTIMENTO IMOBILIÁRIO DE RESPONSABILIDADE LIMITADA;FII EDGE;EDGE;
EMET MULTIESTRATÉGIA FUNDO DE INVESTIMENTO I MOBILIÁRIO RESPONSABILIDADE LIMITADA;FII EMET;EMET;
ENERGY RESORT FUNDO DE INVESTIMENTO IMOBILIÁRIO;FII ENERGY;EGYR;
EQI RECEBÍVEIS IMOBILIÁRIOS FUNDO DE INVESTIMENTO IMOBILIÁRIO RESPONSABILIDADE LIMITADA;FII EQI RECE;EQIR;
ESTOQUE RESIDENCIAL E COMERCIAL RIO DE JANEIRO FUNDO DE INVESTIMENTO IMOBILIÁRIO - RESP LIMITADA;FII ESTOQ RJ;ERCR;
EUROPA 105  FUNDO DE INVESTIMENTO IMOBILIÁRIO - RESPONSABILIDADE LIMITADA;FII EUROPA;ERPA;
EVEN II KINEA FUNDO DE INVESTIMENTO IMOBILIÁRIO RESPONSABILIDADE LIMITADA;FII EVEN II;KEVE;
EXES FUNDO DE INVESTIMENTO IMOBILIÁRIO RESPONSABILIDADE LIMITADA;FII EXES;EXES;
FARIA LIMA CAPITAL RECEBÍVEIS IMOBILIÁRIOS I - FUNDO DE INVESTIMENTO IMOBILIÁRIO RESPONSABILIDADE LI;FII FL RECEB;FLCR;
FATOR VERITA FUNDO DE INVESTIMENTO IMOBILIARIO;FII FATOR VE;VRTA;
FATOR VERITŔ MULTIESTRATÉGIA FUNDO DE INVESTIMENTO IMOBILIÁRIO;FII VRTM;VRTM;
FIGTREE RENDA EDUCACIONAL FUNDO DE INVESTIMENTO IMOBILIÁRIO;FII FTRE;FTRE;
FII CONTINENTAL SQUARE FARIA LIMA - RESPONSABILIDADE LIMITADA;FII S F LIMA;FLMA;
FII DE DESENVOLVIMENTO DE ESCRITÓRIOS BOUTIQUE RESPONSABILIDADE LIMITADA;FII EGDB;EGDB;
FII ELDORADO FUNDO DE INVESTIMENTO IMOBILIÁRIO - RESPONSABILIDADE LIMITADA;FII ELDORADO;ELDO;
FII EUROPAR RESPONSABILIDADE LIMITADA;FII EUROPAR;EURO;
FII HIRE PROPERTIES I - FUNDO DE INVESTIMENTO IMOBILIÁRIO;FII HYPI;HYPI;
FII HIRE RESIDENCIAL I - FUNDO DE INVESTIMENTO IMOBILIÁRIO;FII HIRE RES;HRES;
FII INDUSTRIAL DO BRASIL RESPONSABILIDADE LIMITADA;FII INDL BR;FIIB;
FII MEMORIAL OFFICE RESPONSABILIDADE LIMITADA;FII MEMORIAL;FMOF;
FII PATRIMONIAL IV;FII PATRI IV;OPTM;
FII RBC II FUNDO DE FUNDOS - RESPONSABILIDADE LIMITADA;FII FRBC;FRBC;
FII TORRE ALMIRANTE;FII TORRE AL;ALMI;
FLORIANO FUNDO DE INVESTIMENTO IMOBILIÁRIO;FII FLNR;FLNR;
FRAM CAPITAL HELMER MULTIATIVOS RENDA PREFERENCIAL FUNDO DE INVESTIMENTO IMOBILIÁRIO;FII HLMB;HLMB;
FUNDO DE FUNDOS DE INVESTIMENTO IMOBILIÁRIO KINEA FII RESPONSABILIDADE LIMITADA;FII KINEAFOF;KFOF;
FUNDO DE INVESTIMENTO IMOBILIÁRIO - DEVANT FUNDO DE FUNDOS IMOBILIÁRIOS DE RESPONSABILIDADE LIMITADA;FII DEVA FOF;DVFF;
FUNDO DE INVESTIMENTO IMOBILIÁRIO - FII ANCAR IC - RESPONSABILIDADE LIMITADA;FII ANCAR IC;ANCR;
FUNDO DE INVESTIMENTO IMOBILIÁRIO - FII ANHANGUERA EDUCACIONAL RESPONSABILIDADE LIMITADA;FII ANH EDUC;FAED;
FUNDO DE INVESTIMENTO IMOBILIÁRIO - FII CAMPUS FARIA LIMA RESPONSABILIDADE LIMITADA;FII CAMPUSFL;FCFL;
FUNDO DE INVESTIMENTO IMOBILIÁRIO - FII CEO CYRELA COMMERCIAL PROPERTIES RESPONSABILIDADE LIMITADA;FII CEO CCP;CEOC;
FUNDO DE INVESTIMENTO IMOBILIÁRIO - FII EDIFÍCIO ALMIRANTE BARROSO RESPONSABILIDADE LIMITADA;FII ALMIRANT;FAMB;
FUNDO DE INVESTIMENTO IMOBILIÁRIO - FII EDIFÍCIO GALERIA RESPONSABILIADADE LIMITADA;FII GALERIA;EDGA;
FUNDO DE INVESTIMENTO IMOBILIÁRIO - FII FYTO RECEBÍVEIS IMOBILIÁRIOS RESPONSABILIDADE LIMITADA;FII FYTO;FYTO;
FUNDO DE INVESTIMENTO IMOBILIÁRIO - FII HOSPITAL DA CRIANÇA RESPONSABILIDADE LIMITADA;FII CRIANCA;HCRI;
FUNDO DE INVESTIMENTO IMOBILIÁRIO - FII HOSPITAL NOSSA SENHORA DE LOURDES RESPONSABILIDADE LIMITADA;FII LOURDES;NSLU;
FUNDO DE INVESTIMENTO IMOBILIÁRIO - FII MAX RETAIL RESPONSABILIDADE LIMITADA;FII MAX RET;MAXR;
FUNDO DE INVESTIMENTO IMOBILIÁRIO - FII PARQUE DOM PEDRO SHOPPING CENTER RESPONSABILIDADE LIMITADA;FII D PEDRO;PQDP;
FUNDO DE INVESTIMENTO IMOBILIÁRIO - FII RBR DESENVOLVIMENTO III RESPONSABILIDADE LIMITADA;FII RBR III;RBRI;
FUNDO DE INVESTIMENTO IMOBILIÁRIO - FII RBR DESENVOLVIMENTO IV RESPONSABILIDADE LIMITADA;FII RBRDESIV;RDIV;
FUNDO DE INVESTIMENTO IMOBILIARIO - FII RBR RENDIMENTO HIGH GRADE RESPONSABILIDADE LIMITADA;FII RBRR PAX;RBRR;
FUNDO DE INVESTIMENTO IMOBILIÁRIO - FII REC RECEBÍVEIS IMOBILIÁRIOS - RESPONSABILIDADE LIMITADA;FII REC RECE;RECR;
FUNDO DE INVESTIMENTO IMOBILIÁRIO - FII REC RENDA IMOBILIÁRIA - RESPONSABILIDADE LIMITADA;FII REC REND;RECT;
FUNDO DE INVESTIMENTO IMOBILIÁRIO - FII SHOPPING PARQUE D. PEDRO RESPONSABILIDADE LIMITADA;FII SHOP PDP;SHDP;
FUNDO DE INVESTIMENTO IMOBILIÁRIO - FII TORRE NORTE;FII TORRE NO;TRNT;
FUNDO DE INVESTIMENTO IMOBILIÁRIO APEX REALTY - FII;FII APXR;APXR;
FUNDO DE INVESTIMENTO IMOBILIÁRIO BR HOTÉIS;FII BRHOTEIS;BRHT;
FUNDO DE INVESTIMENTO IMOBILIÁRIO BRC-IV DESENVOLVIMENTO RESPONSABILIDADE LIMITADA;FII BRCQ;BRCQ;
FUNDO DE INVESTIMENTO IMOBILIÁRIO CAIXA AGĘNCIAS - RESPONSABILIDADE LIMITADA;FII CAIXA AG;CXAG;
FUNDO DE INVESTIMENTO IMOBILIÁRIO CAIXA CARTEIRA IMOBILIÁRIA RESPONSABILIDADE LIMITADA;FII CAIXA CI;CXCI;
FUNDO DE INVESTIMENTO IMOBILIÁRIO CAIXA CEDAE RESPONSABILIDADE LIMITADA;FII CX CEDAE;CXCE;
FUNDO DE INVESTIMENTO IMOBILIARIO CAIXA SEQ LOGISTICA RENDA RESPONSABILIDADE LIMITADA;FII CX TRX;CXTL;
FUNDO DE INVESTIMENTO IMOBILIÁRIO DE UNIDADES AUTÔNOMAS IV;FII IDUA;IDUA;
FUNDO DE INVESTIMENTO IMOBILIÁRIO DEVELOPMENT V1 RESPONSABILIDADE LIMITADA;FII DEV ONE;LKDV;
FUNDO DE INVESTIMENTO IMOBILIÁRIO EDIFÍCIO OURINVEST - RESPONSABILIDADE LIMITADA;FII OURINVES;EDFO;
FUNDO DE INVESTIMENTO IMOBILIÁRIO FII NOVO HORIZONTE - RESPONSABILIDADE LIMITADA;FII NOVOHORI;NVHO;
FUNDO DE INVESTIMENTO IMOBILIÁRIO GREEN TOWERS RESPONSABILIDADE LIMITADA;FII G TOWERS;GTWR;
FUNDO DE INVESTIMENTO IMOBILIÁRIO HBC RENDA URBANA;FII HBC REN;HBCR;
FUNDO DE INVESTIMENTO IMOBILIÁRIO HOSPITAL UNIMED CAMPINA GRANDE RESPONSABILIDADE LIMITADA;FII UNIMED C;HUCG;
FUNDO DE INVESTIMENTO IMOBILIARIO HOSPITAL UNIMED SUL CAPIXABA;FII H UNIMED;HUSC;
FUNDO DE INVESTIMENTO IMOBILIÁRIO HOUSI RESPONSABILIDADE LIMITADA;FII HOUSI;HOSI;
FUNDO DE INVESTIMENTO IMOBILIÁRIO INFRA REAL ESTATE - FII RESPONSABILIDADE LIMITADA;FII INFRA RE;FINF;
FUNDO DE INVESTIMENTO IMOBILIÁRIO MACAM SHOPPING RESPONSABILIDADE LIMITADA;FII BLUE;BLUE;
FUNDO DE INVESTIMENTO IMOBILIÁRIO MAUÁ CAPITAL MPD DESENVOLVIMENTO RESIDENCIAL RESP LIMITADA;FII MAUA MPD;MMPD;
FUNDO DE INVESTIMENTO IMOBILIÁRIO MAUÁ CAPITAL RECEBÍVEIS IMOBILIÁRIOS - FII RESPONSABILIDADE LIMITA;FII MAUA;MCCI;
FUNDO DE INVESTIMENTO IMOBILIÁRIO OURINVEST RE I - RESPONSABILIDADE LIMITADA;FII WTC SP;WTSP;
FUNDO DE INVESTIMENTO IMOBILIÁRIO PANAMBY;FII PANAMBY;PABY;
FUNDO DE INVESTIMENTO IMOBILIÁRIO PATRIMONIAL V RESPONSABILIDADE LIMITADA;FII VOTP V;VTPA;
FUNDO DE INVESTIMENTO IMOBILIÁRIO PEDRA NEGRA RENDA IMOBILIÁRIA - RESPONSABILIDADE LIMITADA;FII P NEGRA;FPNG;
FUNDO DE INVESTIMENTO IMOBILIÁRIO PLUS RESPONSABILIDADE LIMITADA;FII PLUS;VTPL;
FUNDO DE INVESTIMENTO IMOBILIARIO POLO ESTOQUE II RESPONSABILIDADE LIMITADA;FII POLO II;ESTQ;
FUNDO DE INVESTIMENTO IMOBILIÁRIO POLO SHOPPING INDAIATUBA - RESPONSABILIDADE LIMITADA;FII POLO SHO;VPSI;
FUNDO DE INVESTIMENTO IMOBILIÁRIO RBR CRÉDITO IMOBILIÁRIO ESTRUTURADO RESPONSABILIDADE LIMITADA;FII RBRY PAX;RBRY;
FUNDO DE INVESTIMENTO IMOBILIÁRIO RBR PROPERTIES - FII RESPONSABILIDADE LIMITADA;FII RBRP PAX;RBRP;
FUNDO DE INVESTIMENTO IMOBILIÁRIO REC LOGÍSTICA - RESPONSABILIDADE  LIMITADA;FII REC LOG;RELG;
FUNDO DE INVESTIMENTO IMOBILIÁRIO REC LOGÍSTICA II - RESPONSABILIDADE LIMITADA;FII RLGX;RLGX;
FUNDO DE INVESTIMENTO IMOBILIÁRIO RIVIERA RESIDENCIAL - RESPONSABILIDADE LIMITADA;FII RRES;RRES;
FUNDO DE INVESTIMENTO IMOBILIÁRIO RIZA TERRAX;FII RIZA TX;RZTR;
FUNDO DE INVESTIMENTO IMOBILIÁRIO ROOFTOP I RESPONSABILIDADE LIMITADA;FII ROOFTOPI;ROOF;
FUNDO DE INVESTIMENTO IMOBILIÁRIO ROOFTOP III RESPONSABILIDADE LIMITADA;FII HOMS;HOMS;
FUNDO DE INVESTIMENTO IMOBILIÁRIO SC 401 - RESPONSABILIDADE LIMITADA;FII SC 401;FISC;
FUNDO DE INVESTIMENTO IMOBILIARIO SIA CORPORATE RESPONSABILIDADE LIMITADA;FII SIA CORP;SAIC;
FUNDO DE INVESTIMENTO IMOBILIÁRIO SMART REAL ESTATE - FII RESPONSABILIDADE LIMITADA;FII SMRE;SMRE;
FUNDO DE INVESTIMENTO IMOBILIÁRIO SOFIA;FII SOFF;SOFF;
FUNDO DE INVESTIMENTO IMOBILIÁRIO SUCCESPAR VAREJO RESPONSABILIDADE LIMITADA;FII S VAREJO;SPVJ;
FUNDO DE INVESTIMENTO IMOBILIÁRIO TG ATIVO REAL;FII TG ATIVO;TGAR;
FUNDO DE INVESTIMENTO IMOBILIÁRIO TORRE RIO CLARO OFFICES - RESPONSABILIDADE LIMITADA;FII TRCO;TRCO;
FUNDO DE INVESTIMENTO IMOBILIÁRIO TRUE MULTIESTRATÉGIA - RESPONSABILIDADE LIMITADA;FII TRUEMULT;TRUE;
FUNDO DE INVESTIMENTO IMOBILIÁRIO VBI LOGÍSTICO - RESPONSABILIDADE LIMITADA;FII LVBI VBI;LVBI;
FUNDO DE INVESTIMENTO IMOBILIÁRIO VBI PRIME PROPERTIES - RESPONSABILIDADE LIMITADA;FII PVBI VBI;PVBI;
FUNDO DE INVESTIMENTO IMOBILIÁRIO VEREDA - FII RESPONSABILIDADE LIMITADA;FII VEREDA;VERE;
FUNDO DE INVESTIMENTO IMOBILIÁRIO VIDA NOVA - FII - RESPONSABILIDADE LIMITADA;FII VIDANOVA;FIVN;
FUNDO DE INVESTIMENTO IMOBILIÁRIO VOTORANTIM SHOPPING;FII VOT SHOP;VSHO;
FUNDO DE INVESTIMENTOS  IMOBILIÁRIOS DE PERMUTA FINANCEIRA LOTE5 MEZANINO RESPONSABILIDADE  LIMITADA;FII BMLT;BMLT;
FUNDO DE INVESTIMENTOS IMOBILIÁRIO DO CAMPREV PARA SUSTENTABILIDADE PREVIDENCIÁRIA DO MUNICÍPIO;FII FIIC;FIIC;
FUNDO DE INVESTIMENTOS IMOBILIÁRIOS DE PERMUTA FINANCEIRA LOTE5 (SENIOR) RESPONSABILIDADE LIMITADA;FII BSLT;BSLT;
G5 CIDADE NOVA FUNDO DE INVESTIMENTO IMOBILIÁRIO;FII TOUR V;TCIN;
GALAPAGOS DESENVOLVIMENTO LOGÍSTICO FUNDO DE INVESTIMENTO IMOBILIÁRIO RESPONSABILIDADE LIMITADA;FII GCDL;GCDL;
GALAPAGOS DESENVOLVIMENTO RESIDENCIAL FUNDO DE INVESTIMENTO IMOBILIÁRIO RESPONSABILIDADE LIMITADA;FII GSRF;GSRF;
GALAPAGOS FEEDER DESENVOLVIMENTO LOGÍSTICO FUNDO DE INVESTIMENTO IMOBILIÁRIO RESPONSABILIDADE LIMITA;FII GFDL;GFDL;
GALAPAGOS FEEDER LOGÍSTICO FUNDO DE INVESTIMENTO IMOBILIÁRIO RESPONSABILIDADE LIMITADA;FII GLPF;GLPF;
GALAPAGOS HEDGE FUND FUNDO DE INVESTIMENTO IMOBILIÁRIO RESPONSABILIDADE LIMITADA;FII GLCR;GLCR;
GALAPAGOS RECEBÍVEIS IMOBILIÁRIOS FUNDO DE INVESTIMENTO IMOBILIÁRIO RESPONSABILIDADE LIMITADA;FII GLPG CRI;GCRI;
GALAPAGOS SPECIAL OPORTUNITIES FUNDO DE INVESTIMENTO IMOBILIÁRIO;FII GALAP SP;GCOI;
GAZIT MALLS FUNDO DE INVESTIMENTO IMOBILIÁRIO RESPONSABILIDADE LIMITADA;FII GAZIT;GZIT;
GENERAL SHOPPING ATIVO E RENDA FUNDO DE INVESTIMENTO IMOBILIÁRIO DE RESPONSABILIDADE LIMITADA;FII GEN SHOP;FIGS;
GENERAL SHOPPING E OUTLETS DO BRASIL FUNDO DE INVESTIMENTO IMOBILIÁRIO RESPONSABILIDADE LIMITADA;FII GENERAL;GSFI;
GENESIS MULTIESTRATÉGIA FUNDO DE INVESTIMENTO IMOBILIÁRIO - FII -  RESPONSABILIDADE LIMITADA;FII VX XVI;VXXV;
GENIAL LOGÍSTICA - FUNDO DE INVESTIMENTO IMOBILIÁRIO - RESPONSABILIDADE LIMITADA;FII PLURAL L;GLOG;
GRAND PLAZA SHOPPING FUNDO DE INVESTIMENTO IMOBILIÁRIO - RESPONSABILIDADE LIMITADA;FII ABC IMOB;ABCP;
GRUPO RCFA FUNDO DE INVESTIMENTO IMOBILIARIO;FII GP RCFA;RCFA;
GUARDIAN MULTIESTRATÉGIA IMOBILIÁRIA I FII DE RESPONSABILIDADE LIMITADA;FII GUARD MU;GAME;
GUARDIAN REAL ESTATE FUNDO DE INVESTIMENTO IMOBILIÁRIO DE RESPONSABILIDADE LIMITADA;FII GUARDIAN;GARE;
HABITAT RECEBÍVEIS PULVERIZADOS FUNDO DE INVESTIMENTO IMOBILIÁRIO RESPONSABILIDADE LIMITADA;FII HABIT II;HABT;
HAZ FUNDO DE INVESTIMENTO IMOBILIÁRIO;FII HAZ;ATCR;
HCO CURITIBA I FUNDO DE INVESTIMENTO IMOBILIÁRIO DE RESPONSABILIDADE LIMITADA;FII HCTB;HCTB;
HCO OPPS AERO I FII DE RESPONSABILIDADE LIMITADA;FII AERO;AERO;
HECTARE CE FUNDO DE INVESTIMENTO IMOBILIÁRIO RESPONSABILIDADE LIMITADA;FII HECTARE;HCTR;
HECTARE DESENVOLVIMENTO STUDENT HOUSING - FUNDO DE INVESTIMENTO IMOBILIÁRIO RESPONSABILIDADE LIMITAD;FII HECT DES;HCST;
HECTARE RECEBÍVEIS HIGH GRADE FUNDO DE INVESTIMENTO IMOBILIÁRIO - FII - RESP LIMITADA;FII HECT CRI;HCHG;
HEDGE AAA FUNDO DE INVESTIMENTO IMOBILIÁRIO DE RESPONSABILIDADE LIMITADA;FII HEDGEAAA;HAAA;
HEDGE ATRIUM SHOPPING SANTO ANDRÉ FUNDO DE INVESTIMENTO IMOBILIÁRIO DE RESPONSABILIDADE LIMITADA;FII HATRIUM;ATSA;
HEDGE BRASIL LOGÍSTICO INDUSTRIAL FUNDO DE INVESTIMENTO IMOBILIÁRIO DE RESPONSABILIDADE LIMITADA;FII HGBL;HGBL;
HEDGE BRASIL SHOPPING FUNDO DE INVESTIMENTO IMOBILIÁRIO DE RESPONSABILIDADE LIMITADA;FII HEDGEBS;HGBS;
HEDGE DESENVOLVIMENTO LOGÍSTICO FUNDO DE INVESTIMENTO IMOBILIÁRIO DE RESPONSABILIDADE LIMITADA;FII HEDGE DV;HDEL;
HEDGE FLORIPA SHOPPING FUNDO DE INVESTIMENTO IMOBILIÁRIO DE RESPONSABILIDADE LIMITADA;FII FLORIPA;FLRP;
HEDGE JHSF CAPITAL PRIME OFFICES FUNDO DE INVESTIMENTO IMOBILIÁRIO DE RESPONSABILIDADE LIMITADA;FII HJCT;HJCT;
HEDGE LOGÍSTICA FUNDO DE INVESTIMENTO IMOBILIÁRIO DE RESPONSABILIDADE LIMITADA;FII HEDGELOG;HLOG;
HEDGE OFFICE INCOME FUNDO DE INVESTIMENTO IMOBILIÁRIO DE RESPONSABILIDADE LIMITADA;FII HOFFICEI;HOFC;
HEDGE PALADIN DESIGN OFFICES FUNDO DE INVESTIMENTO IMOBILIÁRIO DE RESPONSABILIDADE LIMITADA;FII HEDGE OF;HDOF;
HEDGE REALTY DEVELOPMENT FUNDO DE INVESTIMENTO IMOBILIÁRIO DE RESPONSABILIDADE LIMITADA;FII HREALTY;HRDF;
HEDGE RECEBÍVEIS IMOBILIÁRIOS FUNDO DE INVESTIMENTO IMOBILIÁRIO DE RESPONSABILIDADE LIMITADA;FII HEDGEREC;HREC;
HEDGE SEED FUNDO DE INVESTIMENTO IMOBILIARIO DE RESPONSABILIDADE LIMITADA;FII HEDGE SD;SEED;
HEDGE SHOPPING PARQUE DOM PEDRO FUNDO DE INVESTIMENTO IMOBILIÁRIO DE RESPONSABILIDADE LIMITADA;FII HEDGEPDP;HPDP;
HEDGE TOP FOFII 3 FUNDO DE INVESTIMENTO IMOBILIÁRIO DE RESPONSABILIDADE LIMITADA;FII HTOPFOF3;HFOF;
HEDGE YEES HABITAÇŐES ECONÔMICAS FUNDO DE INVESTIMENTO IMOBILIÁRIO DE RESPONSABILIDADE LIMITADA;FII YEES;YEES;
HGI CRÉDITOS IMOBILIÁRIOS FUNDO DE INVESTIMENTO IMOBILIÁRIO RESPONSABILIDADE LIMITADA;FII HGI CRI;HGIC;
HIRE FUNDO DE INVESTIMENTO IMOBILIÁRIO RESPONSABILIDADE LIMITADA;FII HIRE;HIRE;
HIRE LOG I - FUNDO DE INVESTIMENTO IMOBILIÁRIO;FII HIRE LOG;HILG;
HOTEL MAXINVEST FUNDO DE INVESTIMENTO IMOBILIÁRIO RESPONSABILIDADE LIMITADA;FII HOTEL MX;HTMX;
HSI ATIVOS FINANCEIROS FUNDO DE INVESTIMENTO IMOBILIÁRIO DE RESP LIMITADA;FII HSI CRI;HSAF;
HSI LOGÍSTICA FUNDO DE INVESTIMENTO IMOBILIÁRIO DE RESP LIMITADA;FII HSI LOG;HSLG;
HSI MALLS FUNDO DE INVESTIMENTO IMOBILIÁRIO DE RESPONSABILIDADE LIMITADA;FII HSI MALL;HSML;
HSI RENDA IMOBILIÁRIA FUNDO DE INVESTIMENTO IMOBILIÁRIO DE RESP LIMITADA;FII HSIRENDA;HSRE;
HUSI FUNDO DE INVESTIMENTO IMOBILIÁRIO;FII HUSI;HUSI;
ICATU VANGUARDA CRÉDITO IMOBILIÁRIO FUNDO DE INVESTIMENTO IMOBILIÁRIO - RESPONSABILIDADE LIMITADA;FII IVCI;IVCI;
ICATU VANGUARDA GRU  LOGÍSTICO FUNDO DE INVESTIMENTO IMOBILIÁRIO - RESPONSABILIDADE LIMITADA;FII GRUL;GRUL;
ÍCONE - FUNDO DE INVESTIMENTO IMOBILIÁRIO RESPONSABILIDADE LIMITADA;FII ICNE;ICNE;
IMMOBINVEST FUNDO DE INVESTIMENTO IMOBILIÁRIO RESPONSABILIDADE LIMITADA;FII IMMB;IMMB;
INTER DESENVOLVIMENTO FUNDO DE INVESTIMENTO IMOBILIÁRIO RESPONSABILIDADE LIMITADA;FII INDE;INDE;
INTER LOGÍSTICO FUNDO DE INVESTIMENTO IMOBILIÁRIO FII RESPONSABILIDADE LIMITADA;FII INTER LG;INLG;
INTER RESIDENCE FUNDO DE INVESTIMENTO IMOBILIÁRIO FII RESPONSABILIDADE LIMITADA;FII INTER RD;INRD;
INTER TEVA ÍNDICE DE PAPEL FUNDO DE INVESTIMENTO IMOBILIÁRIO FII RESPONSABILIDADE LIMITADA;FII INTER IP;ITIP;
INTER TEVA ÍNDICE DE TIJOLO FUNDO DE INVESTIMENTO IMOBILIÁRIO FII RESPONSABILIDADE LIMITADA;FII INTER IT;ITIT;
INVISTA BRAZILIAN BUSINESS PARK FUNDO DE INVESTIMENTO IMOBILIÁRIO;FII IBBP;IBBP;
INVISTA INDUSTRIAL FUNDO DE INVESTIMENTO IMOBILIÁRIO;FII XP INDL;XPIN;
IRIDIUM FUNDO DE INVESTIMENTO IMOBILIÁRIO RESPONSABILIDADE LIMITADA;FII IRIM;IRIM;
ITAÚ CRÉDITO IMOBILIÁRIO CDI FUNDO DE INVESTIMENTO IMOBILIÁRIO RESPONSABILIDADE LIMITADA;FII ICDI;ICDI;
ITAÚ CRÉDITO IMOBILIÁRIO IPCA FUNDO DE INVESTIMENTO IMOBILIÁRIO RESPONSABILIDADE LIMITADA;FII CI IPCA;ICRI;
ITAÚ RBR DESENVOLVIMENTO LOGÍSTICO - FUNDO DE INVESTIMENTO IMOBILIÁRIO RESPONSABILIDADE LIMITADA;FII ILOG;ILOG;
ITAÚ TEMPUS FUNDO DE INVESTIMENTO IMOBILIÁRIO RESPONSABILIDADE LIMITADA;FII ITAU TEM;TMPS;
ITAÚ TOTAL RETURN FUNDO DE INVESTIMENTO IMOBILIÁRIO RESPONSABILIDADE LIMITADA;FII ITRI;ITRI;
JACARANDÁ 02 FUNDO DE INVESTIMENTO IMOBILIÁRIO RESPONSABILIDADE LIMITADA;FII JCDB 02;JCDB;
