Razăo Social;Fundo;Código
JACARANDÁ I FUNDO DE INVESTIMENTO IMOBILIÁRIO - RESPONSABILIDADE LIMITADA;FII JCDA I;JCDA;
JASC RENDA VAREJO ESSENCIAL FUNDO DE INVESTIMENTO IMOBILIÁRIO RESPONSABILIDADE LIMITADA;FII JASC REN;JASC;
JFDCAM - FUNDO DE INVESTIMENTO IMOBILIÁRIO - FII - RESPONSABILIDADE LIMITADA;FII JFDCAM;VJFD;
JFL LIVING FUNDO DE INVESTIMENTO IMOBILIÁRIO RESPONSABILIDADE LIMITADA;FII JFL LIV;JFLL;
JFL REAL ESTATE FUNDO DE INVESTIMENTO IMOBILIÁRIO;FII JFLR;JFLR;
JHSF CAPITAL MALLS - FUNDO DE INVESTIMENTO IMOBILIÁRIO RESPONSABILIDADE LIMITADA;FII JHSF CJ;JCCJ;
JPP CAPITAL RECEBÍVEIS IMOBILIÁRIOS FUNDO DE INVESTIMENTO IMOBILIÁRIO DE  RESPONSABILIDADE LIMITADA;FII JPPA CRI;JPPA;
JS ATIVOS FINANCEIROS FUNDO DE INVESTIMENTO IMOBILIÁRIO - RESPONSABILIDADE LIMITADA;FII JS A FIN;JSAF;
JS REAL ESTATE MULTIGESTĂO FUNDO DE INVESTIMENTO IMOBILIÁRIO - RESPONSABILIDADE LIMITADA;FII JS REAL;JSRE;
JS RECEBÍVEIS IMOBILIÁRIOS FUNDO DE INVESTIMENTO IMOBILIÁRIO;FII JSCR;JSCR;
JT PREV FUNDO DE INVESTIMENTO IMOBILIÁRIO D. HAB;FII JT PREV;JTPR;
JUBARTE BGS LOGÍSTICA DE GRĂOS DESENVOLVIMENTO FII RESPONSABILIDADE LIMITADA;FII BGS1;BGS1;
KILIMA FUNDO DE INVESTIMENTO EM COTAS DE FUNDOS IMOBILIÁRIOS SUNO 30 RESPONSABILIDADE LIMITADA;FII KILIMA;KISU;
KILIMA VOLKANO RECEBÍVEIS IMOBILIÁRIOS FUNDO DE INVESTIMENTO IMOBILIÁRIO - RESPONSABILIDADE LIMITADA;FII KIVO;KIVO;
KINEA AQUISIÇŐES RESIDENCIAIS FUNDO DE INVESTIMENTO IMOBILIÁRIO - RESPONSABILIDADE LIMITADA;FII KRES;KRES;
KINEA CREDITAS FUNDO DE INVESTIMENTO IMOBILIÁRIO RESPONSABILIDADE LIMITADA;FII KINEA CR;KCRE;
KINEA DESENVOLVIMENTO GUARARÁ FUNDO DE INVESTIMENTO IMOBILIÁRIO RESPONSABILIDADE LIMITADA;FII KNGR;KNGR;
KINEA DESENVOLVIMENTO GUARARÁ JARDINS FUNDO DE INVESTIMENTO IMOBILIÁRIO RESPONSABILIDADE LIMITADA;FII KGUJ;KGUJ;
KINEA DESENVOLVIMENTO LOGÍSTICO FUNDO DE INVESTIMENTO IMOBILIÁRIO RESPONSABILIDADE LIMITADA;FII KINEA DL;KLOG;
KINEA DESENVOLVIMENTO LOGÍSTICO II FUNDO DE INVESTIMENTO IMOBILIÁRIO RESPONSABILIDADE LIMITADA;FII KDLG;KDLG;
KINEA FĘNIX FUNDO DE INVESTIMENTO IMOBILIÁRIO - RESPONSABILIDADE LIMITADA;FII KFEN;KFEN;
KINEA HEDGE FUND FUNDO DE INVESTIMENTO IMOBILIÁRIO - RESPONSABILIDADE LIMITADA;FII KINEA HF;KNHF;
KINEA HIGH YIELD CRI FUNDO DE INVESTIMENTO IMOBILIÁRIO  RESPONSABILIDADE LIMITADA;FII KINEA HY;KNHY;
KINEA II REAL ESTATE EQUITY FUNDO DE INVESTIMENTO IMOBILIÁRIO RESPONSABILIDADE LIMITADA;FII KII REAL;KNRE;
KINEA ÍNDICES DE PREÇOS FUNDO DE INVESTIMENTO IMOBILIÁRIO RESPONSABILIDADE LIMITADA;FII KINEA IP;KNIP;
KINEA OPORTUNIDADES IMOBILIÁRIAS FUNDO DE INVESTIMENTO IMOBILIÁRIO RESPONSABILIDADE LIMITADA;FII KOIM;KOIM;
KINEA OPORTUNIDADES REAL ESTATE FUNDO DE INVESTIMENTO IMOBILIÁRIO - RESPONSABILIDADE LIMITADA;FII KORE;KORE;
KINEA PREMIUM PROPERTIES FUNDO DE INVESTIMENTO IMOBILIÁRIO - RESPONSABILIDADE LIMITADA;FII KINEA PR;KNPR;
KINEA PRIME RESIDENCIAL I FUNDO DE INVESTIMENTO IMOBILIÁRIO DE RESPONSABILIDADE LIMITADA;FII KPMR;KPMR;
KINEA PRIME RESIDENCIAL I PVT FUNDO DE INVESTIMENTO IMOBILIÁRIO DE RESPONSABILIDADE LIMITADA;FII KPRP;KPRP;
KINEA RENDA IMOBILIÁRIA FUNDO DE INVESTIMENTO IMOBILIÁRIO RESPONSABILIDADE LIMITADA;FII KINEA;KNRI;
KINEA RENDIMENTOS IMOBILIÁRIOS FUNDO DE INVESTIMENTO IMOBILIÁRIO RESPONSABILIDADE LIMITADA;FII KINEA RI;KNCR;
KINEA SECURITIES FUNDO DE INVESTIMENTO IMOBILIÁRIO RESPONSABILIDADE LIMITADA;FII KINEA SC;KNSC;
KINEA UNIQUE HY CDI FUNDO DE INVESTIMENTO IMOBILIÁRIO RESPONSABILIDADE LIMITADA;FII KINEA UN;KNUQ;
LABINA MULTI ATIVOS IMOBILIÁRIOS - FUNDO DE INVESTIMENTO IMOBILIÁRIO RESPONSABILIDADE LIMITADA;LABINAFII;LMAI;
LAGO DA PEDRA - FUNDO DE INVESTIMENTO IMOBILIÁRIO;FII LAGO PDR;LPLP;
LAV SLDZ DESENVOLVIMENTO IMOBILIÁRIO FUNDO DE INVESTIMENTO IMOBILIÁRIO;FII LAV SLDZ;SLDZ;
LCP REAL ESTATE DEVELOPMENT FUNDO DE INVESTIMENTO IMOBILIÁRIO RESPONSABILIDADE LIMITADA;FII LRED;LRED;
LCP SPECIAL OPPORTUNITIES I FUNDO DE INVESTIMENTO IMOBILIÁRIO RESPONSABILIDADE LIMITADA;FII LSOI;LSOI;
LCP SPECIAL OPPORTUNITIES II FUNDO DE INVESTIMENTO IMOBILIÁRIO RESPONSABILIDADE LIMITADA;FII LSII;LSII;
LCP SPECIAL OPPORTUNITIES III FUNDO DE INVESTIMENTO IMOBILIÁRIO RESPONSABILIDADE LIMITADA;FII LSOP;LSOP;
LEBLON REALTY DESENVOLVIMENTO I FUNDO DE INVESTIMENTO IMOBILIÁRIO RESPONSABILIDADE LIMITADA;FII LEBLON;LRDI;
LEGATUS FUNDO DE INVESTIMENTO IMOBILIÁRIO RESPONSABILIDADE LIMITADA;FII LEGATUS;LASC;
LIFE CAPITAL PARTNERS FUNDO DE INVESTIMENTOS IMOBILIÁRIOS;FII LIFE;LIFE;
LOFT I FUNDO DE INVESTIMENTO IMOBILIÁRIO RESPONSABILIDADE LIMITADA;FII LOFT I;LOFT;
MAG MULT FII RESPONSABILIDADE LIMITADA;FII MAGM;MAGM;
MAG MULTIESTRATÉGIA CLASSE DE INVESTIMENTO IMOBILIÁRIO RESPONSABILIDADE LIMITADA;FII MAGM;MAGM;
MANATÍ CAPITAL HEDGE FUND FUNDO DE INVESTIMENTO IMOBILIÁRIO DE RESPONSABILIDADE LIMITADA;FII MANATI;MANA;
MARESIAS FUNDO DE INVESTIMENTO IMOBILIÁRIO;FII MMVE OP;MMVE;
MAUÁ CAPITAL LOGÍSTICA FUNDO DE INVESTIMENTO IMOBILIÁRIO - RESPONSABILIDADE LIMITADA;FII MCLO;MCLO;
MAUÁ CAPITAL REAL ESTATE FUNDO DE INVESTIMENTO IMOBILIÁRIO RESPONSABILIDADE LIMITADA;FII MAUA RE;MCRE;
MAXI RENDA FUNDO DE INVESTIMENTO IMOBILIÁRIO - FII - RESPONSABILIDADE LIMITADA;FII MAXI REN;MXRF;
MÉRITO CEMITÉRIOS FII - FUNDO DE INVESTIMENTO IMOBILIÁRIO RESPONSABILIDADE LIMITADA;FII MCEM;MCEM;
MERITO DESENVOLVIMENTO IMOBILIARIO I FII - FUNDO DE INVESTIMENTO IMOBILIARIO;FII MERITO I;MFII;
MIDWAY MALL FUNDO DE INVESTIMENTO IMOBILIÁRIO RESPONSABILIDADE LIMITADA;FII MIDW;MIDW;
MOGNO PROPERTIES FUNDO DE INVESTIMENTO IMOBILIÁRIO RESPONSABILIDADE LIMITADA;FII MGRI;MGRI;
MOSO FUNDO DE INVESTIMENTO IMOBILIÁRIO RESPONSABILIDADE LIMITADA;FII MOSO;MOSO;
MULTI SHOPPINGS FUNDO DE INVESTIMENTO IMOBILIÁRIO RESPONSABILIDADE LIMITADA;FII MULTSHOP;SHOP;
MULTIOFFICES 2 - FUNDO DE INVESTIMENTO IMOBILIÁRIO - RESPONSABILIDADE LIMITADA;FII MULT OF2;MOFF;
NAVI CRÉDITO IMOBILIÁRIO FUNDO DE INVESTIMENTO IMOBILIÁRIO - RESPONSABILIDADE LIMITADA;FII NAVI CRI;NCRI;
NAVI IMOBILIÁRIO TOTAL RETURN FUNDO DE INVESTIMENTO IMOBILIÁRIO RESPONSABILIDADE LIMITADA;FII NAVI TOT;NAVT;
NAVI RESIDENCIAL FUNDO DE INVESTIMENTO IMOBILIÁRIO - RESPONSABILIDADE  LIMITADA;FII NAVI RSD;APTO;
NEST EAGLE FUNDO DE INVESTIMENTO IMOBILIÁRIO DE RESPONSABILIDADE LIMITADA;FII EAGL;EAGL;
NEWPORT LOGÍSTICA FUNDO DE INVESTIMENTO IMOBILIÁRIO RESPONSABILIDADE LIMITADA;FII NEWPORT;NEWL;
NEWPORT RENDA URBANA FUNDO DE INVESTIMENTO IMOBILIÁRIO RESPONSABILIDADE LIMITADA;FII NEWRU;NEWU;
NM KSM LOG FUNDO DE INVESTIMENTO IMOBILIÁRIO RESPONSABILIDADE LIMITADA;FII NMKS;NMKS;
NOVA I - FUNDO DE INVESTIMENTO IMOBILIÁRIO - RESPONSABILIDADE LIMITADA;FII NOVA I;NVIF;
OCTO FUNDO DE INVESTIMENTO IMOBILIÁRIO RESPONSABILIDADE LIMITADA;FII OCTO;OCRE;
ONDA INVEST MULTIESTRATÉGIA FUNDO DE INVESTIMENTO IMOBILIÁRIO RESPONSABILIDADE LIMITADA;FII ONDA ME;ONDA;
OPEN K ATIVOS E RECEBIVEIS IMOBILIARIOS - FUNDO DE INVESTIMENTO IMOBILIARIO;FII ATRIO;ARRI;
OPPORTUNITY BALASSIANO FUNDO DE INVESTIMENTO IMOBILIÁRIO -  RESPONSABILIDADE LIMITADA;FII OPPBAL;OBAL;
OPPORTUNITY FUNDO DE INVESTIMENTO IMOBILIÁRIO -  RESPONSABILIDADE LIMITADA;FII OPPORTUN;FTCE;
OURINVEST JPP FUNDO DE INVESTIMENTO IMOBILIÁRIO DE  RESPONSABILIDADE LIMITADA;FII OURI JPP;OUJP;
OXIGĘNIO 2 FUNDO DE INVESTIMENTO IMOBILIÁRIO - RESPONSABILIDADE LIMITADA;FII OXRL;OXRL;
PANORAMA DESENVOLVIMENTO LOGÍSTICO - FUNDO DE INVESTIMENTO IMOBILIÁRIO - RESPONSABILIDADE LIMITADA;FII PANORAMA;PNDL;
PANORAMA LAST MILE SBC - FUNDO DE INVESTIMENTO IMOBILIÁRIO RESPONSABILIDADE LIMITADA;FII LASTMILE;PNLM;
PANORAMA PROPERTIES FUNDO DE INVESTIMENTO IMOBILIÁRIO;FII PAN PROP;PNPR;
PANORAMA REAL ESTATE CRÉDITO FUNDO DE INVESTIMENTO IMOBILIÁRIO RESPONSABILIDADE LIMITADA;FII PNRC;PNRC;
PARAMIS HEDGE FUND FUNDO DE INVESTIMENTO IMOBILIÁRIO - FII RESPONSABILIDADE LIMITADA;FII PMIS;PMIS;
PARKING PARTNERS FUNDO DE INVESTIMENTO IMOBILIÁRIO - FII - RESP LIMITADA;FII PARK PAR;VTVI;
PARQUE ANHANGUERA FUNDO DE INVESTIMENTO IMOBILIÁRIO DE RESPONSABILIDADE LIMITADA;FII PARQ ANH;PQAG;
PATAGÔNIA CAPITAL MULTIESTRATÉGIA FUNDO DE INVESTIMENTO IMOBILIÁRIO;FII PATA;PATA;
PATEO BANDEIRANTES - FUNDO DE INVESTIMENTO IMOBILIÁRIO RESPONSABILIDADE LIMITADA;FII PTO BAND;PATB;
PATRIA CRÉDITO IMOBILIÁRIO ÍNDICE DE PREÇOS FII - RESPONSABILIDADE LIMITADA;FII PCIP PAX;PCIP;
PÁTRIA EDIFÍCIOS CORPORATIVOS - FUNDO DE INVESTIMENTO IMOBILIÁRIO - RESPONSABILIDADE LIMITADA;FII PATC VBI;PATC;
PATRIA ESCRITÓRIOS - FUNDO DE INVESTIMENTO IMOBILIÁRIO - RESPONSABILIDADE LIMITADA;FII HGRE PAX;HGRE;
PÁTRIA LOG - FUNDO DE INVESTIMENTO IMOBILIÁRIO - RESPONSABILIDADE LIMITADA;FII HGLG PAX;HGLG;
PATRIA LOGÍSTICA AGRO - FUNDO DE INVESTIMENTO IMOBILIÁRIO - RESPONSABILIDADE LIMITADA;FII PLAG;PLAG;
PÁTRIA LOGÍSTICA FUNDO DE INVESTIMENTO IMOBILIÁRIO;FII PATL VBI;PATL;
PATRIA LOGÍSTICA II FUNDO DE INVESTIMENTO IMOBILIÁRIO;FII RBRL PAX;RBRL;
PATRIA MALLS FUNDO DE INVESTIMENTO IMOBILIÁRIO - RESPONSABILIDADE LIMITADA;FII PMLL PAX;PMLL;
PATRIA PRIME OFFICES - FUNDO DE INVESTIMENTO IMOBILIÁRIO - RESPONSABILIDADE LIMITADA;FII HGPO PAX;HGPO;
PÁTRIA RECEBÍVEIS IMOBILIÁRIOS - FUNDO DE INVESTIMENTO IMOBILIÁRIO - RESPONSABILIDADE LIMITADA;FII HGCR PAX;HGCR;
PATRIA RENDA RESIDENCIAL FUNDO DE  INVESTIMENTO IMOBILIÁRIO - RESPONSABILIDADE LIMITADA I FII;FII VECT REN;VCRR;
PÁTRIA RENDA URBANA - FUNDO DE INVESTIMENTO IMOBILIÁRIO - RESPONSABILIDADE LIMITADA;FII HGRU PAX;HGRU;
PATRIA SECURITIES FUNDO DE INVESTIMENTO IMOBILIÁRIO - RESPONSABILIDADE  LIMITADA;FII PSEC PAX;PSEC;
PERFORMA REAL ESTATE FUNDO DE INVESTIMENTO IMOBILIÁRIO - RESPONSABILIDADE LIMITADA;FII PERFORMA;PEMA;
PERMUTA RESIDENCIAL FUNDO DE INVESTIMENTO IMOBILIÁRIO RESPONSABILIDADE LIMITADA;FII PMRL;PMRL;
PERSONALE I FUNDO DE INVESTIMENTO IMOBILIÁRIO RESPONSABILIDADE LIMITADA;FII PERSONAL;PRSN;
POLO CRÉDITO IMOBILIÁRIO - FUNDO DE INVESTIMENTO IMOBILIÁRIO - RESPONSABILIDADE LIMITADA;FII POLO CRI;PORD;
POLO FII - FII RECEBÍVEIS IMOBILIÁRIOS I - RESPONSABILIDADE LIMITADA;FII POLO I;PLRI;
PRAIA DO CASTELO FUNDO DE INVESTIMENTO IMOBILIÁRIO;FII PRAIA CS;PCAS;
PRESIDENTE VARGAS FUNDO DE INVESTIMENTO IMOBILIÁRIO DE RESPONSABILIDADE LIMITADA;FII P VARGAS;PRSV;
PRIME OFFICES FUNDO DE  INVESTIMENTO IMOBILIÁRIO - RESPONSABILIDADE LIMITADA;FII TISHMAN;TSER;
PROJETO ÁGUA BRANCA FUNDO DE INVESTIMENTO IMOBILIÁRIO RESPONSABILIDADE LIMITADA;FII A BRANCA;FPAB;
PROLOGIS BRAZIL LOGISTICS VENTURE FUNDO DE INVESTIMENTO IMOBILIÁRIO DE RESPONSABILIDADE LIMITADA;FII PROLOGIS;PBLV;
QUARTZO REAL ESTATE DEVELOPMENT MULTIESTRATÉGIA FUNDO DE INVESTIMENTO IMOBILIÁRIO RESPONSABILIDADE L;FII QTZD;QTZD;
RAIZZ DESENVOLVIMENTO I FUNDO DE INVESTIMENTO IMOBILIÁRIO - FII RESPONSABILIDADE LIMITADA;FII RZZV;RZZV;
RAIZZ DESENVOLVIMENTO II FUNDO DE INVESTIMENTO IMOBILIÁRIO RESPONSABILIDADE LIMITADA;FII RZZI;RZZI;
RAIZZ RENDA LOGÍSTICA FUNDO DE INVESTIMENTO IMOBILIÁRIO RESPONSABILIDADE LIMITADA;FII RZZR;RZZR;
RB CAPITAL DESENV. RESIDENCIAL II FUNDO DE INVESTIMENTO IMOBILIARIO - RESPONSABILIDADE LIMITADA;FII RBRESID2;RBDS;
RB CAPITAL DESENVOLVIMENTO RESIDENCIAL III FII - RESPONSABILIDADE LIMITADA;FII RBRESID3;RSPD;
RB CAPITAL DESENVOLVIMENTO RESIDENCIAL IV FUNDO DE INVESTIMENTO IMOBILIÁRIO - FII - RESP. LTDA.;FII RBRES IV;RBIR;
RB CAPITAL I FUNDO DE FUNDOS -RESPONSABILIDADE LIMITADA;FII RB CFOF;RFOF;
RB CAPITAL LOGÍSTICO FUNDO DE INVESTIMENTO IMOBILIÁRIO  FII RESPONSABILIDADE LIMITADA;FII RBCAP LG;RBLG;
RB CAPITAL RENDA I FUNDO DE INVESTIMENTO IMOBILIARIO - FII - RESPONSABILIDADE LIMITADA;FII RB CAP I;FIIP;
RB CAPITAL RENDA II FII DE RESP LIMITADA;FII RB II;RBRD;
RB CAPITAL TFO SITUS FUNDO DE INVESTIMENTO IMOBILIÁRIO - FII - RESPONSABILIDADE LIMITADA;FII RB TFO;RBTS;
RB DESENVOLVIMENTO RESIDENCIAL V FUNDO DE INVESTIMENTO IMOBILIÁRIO -RESPONSABILIDADE LIMITADA;FII DRIM;DRIM;
RB INVESTIMENTOS MULTIESTRATÉGIA FUNDO DE INVESTIMENTO IMOBILIÁRIORESPONSABILIDADE LIMITADA;FII MTES;MTES;
RB MULTIESTRATÉGIA IMOBILIÁRIA FUNDO DE INVESTIMENTO IMOBILIÁRIO - RESPONSABILIDADE LIMITADA;FII REME;REME;
RBR DESENVOLVIMENTO COMERCIAL FEEDER FOF - FII RESPONSABILIDADE LIMITADA;FII RBR FEED;RCFF;
RBR DESENVOLVIMENTO COMERCIAL I - FUNDO DE INVESTIMENTO IMOBILIÁRIO RESPONSABILIDADE LIMITADA;FII RDCI;RDCI;
RBR DESENVOLVIMENTO LOGÍSTICO I - FUNDO DE INVESTIMENTO IMOBILIÁRIO RESPONSABILIDADE LIMITADA;FII RDLI;RDLI;
RBR FLAGSHIP I FUNDO DE INVESTIMENTO IMOBILIÁRIO RESPONSABILIDADE LIMITADA;FII SHIP;SHIP;
RBR PLUS MULTIESTRATÉGIA REAL ESTATE FUNDO DE INVESTIMENTO IMOBILIÁRIO RESPONSABILIDADE LIMITADA;FII RBRX PAX;RBRX;
RBR PREMIUM RECEBÍVEIS IMOBILIÁRIOS FUNDO DE INVESTIMENTO IMOBILIÁRIO RESPONSABILIDADE LIMITADA;FII RBR PR;RPRI;
RBR PRIME OFFICES - FUNDO DE INVESTIMENTO IMOBILIÁRIO RESPONSABILIDADE LIMITADA;FII RBRK PAX;RBRK;
RBR TESOURARIA FII CDI+ FUNDO DE INVESTIMENTO IMOBILIÁRIO RESPONSABILIDADE LIMITADA;FII TPOS;TPOS;
RBR TESOURARIA FII IPCA+ FUNDO DE INVESTIMENTO IMOBILIÁRIO RESPONSABILIDADE LIMITADA;FII TINF;TINF;
RBR TOP OFFICES FUNDO DE INVESTIMENTO IMOBILIÁRIO RESPONSABILIDADE LIMITADA;FII TOPP PAX;TOPP;
REAL INVESTOR FUNDO DE INVESTIMENTO IMOBILIÁRIO RESPONSABILIDADE LIMITADA;FII REAL INV;RINV;
REAL INVESTOR RECEBÍVEIS IMOBILIÁRIOS FUNDO DE INVESTIMENTO IMOBILIÁRIO RESPONSABILIDADE LIMITADA;FII RCRI;RCRI;
REC FUNDO DE CRI COTAS AMORTIZÁVEIS - FUNDO DE INVESTIMENTO IMOBILIÁRIO;FII RECD;RECD;
REC MASTER FUNDO DE CRI COTAS AMORTIZÁVEIS FII - RESPONSABILIDADE LIMITADA;FII RMBS;RMBS;
REC MULTIESTRATÉGIA - FUNDO DE INVESTIMENTO IMOBILIÁRIO - RESPONSABILIDADE LIMITADA;FII RECM;RECM;
RIO BRAVO CRÉDITO IMOBILIÁRIO HIGH GRADE FUNDO DE INVESTIMENTO  IMOBILIÁRIO - FII RESP LIMITADA;FII RBCRI IV;RBHG;
RIO BRAVO CRÉDITO IMOBILIÁRIO HIGH YIELD FUNDO DE INVESTIMENTO IMOBILIÁRIO - FII RESP LIMITADA;FII RB YIELD;RBHY;
RIO BRAVO FOR YOU FUNDO DE INVESTIMENTO IMOBILIÁRIO DE RESPONSABILIDADE LIMITADA;FII RBFY;RBFY;
RIO BRAVO MULTIESTRATÉGIA FUNDO DE INVESTIMENTO IMOBILIÁRIO DE RESPONSABILIDADE LIMITADA;FII RIOB MT;RBFM;
RIO BRAVO OPORTUNIDADES IMOBILIÁRIAS FUNDO DE INVESTIMENTO IMOBILIÁRIO DE RESPONSABILIDADE LIMITADA;FII MERC BR;RBOP;
RIO BRAVO RENDA CORPORATIVA FUNDO DE INVESTIMENTO IMOBILIÁRIO - RESPONSABILIDADE LIMITADA;FII RIOB RC;RCRB;
RIO BRAVO RENDA RESIDENCIAL FUNDO DE INVESTIMENTO IMOBILIÁRIO DE RESPONSABILIDADE LIMITADA;FII RIOB RR;RBRS;
RIO BRAVO RENDA VAREJO FUNDO DE INVESTIMENTO IMOBILIÁRIO DE RESPONSABILIDADE LIMITADA;FII RIOB VA;RBVA;
RIO NEGRO FUNDO DE INVESTIMENTO IMOBILIÁRIO DE RESPONSABILIDADE LIMITADA;FII RIONEGRO;RNGO;
RIO REAL  ESTATE FUNDO DE INVESTIMENTO IMOBILIÁRIO DE RESPONSABILIDADE LIMITADA;FII FRRE;FRRE;
RIZA AKIN FUNDO DE INVESTIMENTO IMOBILIÁRIO RESPONSABILIDADE LIMITADA;FII RIZA AKN;RZAK;
RIZA ARCTIUM REAL ESTATE FII - FUNDO DE INVESTIMENTO IMOBILIÁRIO RESPONSABILIDADE LIMITADA;FII ARCTIUM;RZAT;
RIZA LECCI FUNDO DE INVESTIMENTO IMOBILIÁRIO RESPONSABILIDADE LIMITADA;FII RZLC;RZLC;
RJDI FUNDO DE INVESTIMENTO IMOBILIÁRIO;FII RJDA;RJDA;
SANTANDER PAPÉIS IMOBILIÁRIOS FUNDO DE  INVESTIMENTO IMOBILIÁRIO - RESP LIMITADA;FII SAPI;SAPI;
SĂO DOMINGOS - FUNDO DE INVESTIMENTO IMOBILIÁRIO - FII;FII DOMINGOS;FISD;
SCP FII - RESPONSABILIDADE LIMITADA;FII SCP;SCPF;
SEQUÓIA III RENDA IMOBILIÁRIA FUNDO DE INVESTIMENTO IMOBILIÁRIO - RESPONSABILIDADE LIMITADA;FII SEQUOIA;SEQR;
SHOPPING PÁTIO HIGIENÓPOLIS FUNDO DE INVESTIMENTO IMOBILIÁRIO DE RESPONSABILIDADE LIMITADA;FII HIGIENOP;SHPH;
SHOPPING PÁTIO PAULISTA FUNDO DE INVESTIMENTO IMOBILIÁRIO RESPONSABILIDADE  LIMITADA;FII SHPP;SHPP;
SHOPPING WEST PLAZA FUNDO DE INVESTIMENTO IMOBILIARIO DE RESPONSABILIDADE LIMITADA;FII W PLAZA;WPLZ;
SINGULARE FUNDO DE INVESTIMENTO IMOBILIÁRIO;FII REIT RIV;REIT;
SJ AU LOGÍSTICA FUNDO DE INVESTIMENTO IMOBILIÁRIO RESPONSABILIDADE LIMITADA;FII SJ AU;SJAU;
SOLARIUM FII - FUNDO DE INVESTIMENTO IMOBILIÁRIO;FII SOLARIUM;SOLR;
SP DOWNTOWN FUNDO DE INVESTIMENTO IMOBILIÁRIO - FII;FII SPTW PAX;SPTW;
SPA FUNDO DE INVESTIMENTO IMOBILIÁRIO - RESPONSABILIDADE LIMITADA;FII SPA;SPAF;
SPECIALE BLUE REAL FUNDO DE INVESTIMENTO IMOBILIÁRIO DE RESPONSABILIDADE LIMITADA;FII SPECIALE;LTMT;
SPECIALE REAL ESTATE DEVELOPMENT FUNDO DE INVESTIMENTO IMOBILIÁRIO RESPONSABILIDADE LIMITADA;FII DVLP;DVLP;
SPECIALE REAL ESTATE DEVELOPMENT II FUNDO DE INVESTIMENTO  IMOBILIÁRIO DE RESPONSABILIDADE LIMITADA;FII DVLT;DVLT;
SPECIALE REAL ESTATE FUND OF FUNDS FUNDO DE INVESTIMENTO IMOBILIÁRIO DE RESPONSABILIDADE LIMITADA;FII PMFO;PMFO;
SPGM FUNDO DE INVESTIMENTO IMOBILIÁRIO;FII SPGM;SPGM;
SPGM II FUNDO DE INVESTIMENTO IMOBILIÁRIO;FII SPG2;SPG2;
SPX REAL ESTATE DESENVOLVIMENTO DE GALPŐES LOGÍSTICOS FEEDER BRADESCO FII RESPONSABILIDADE LIMITADA;FII SPXM;SPXM;
SPX REAL ESTATE DESENVOLVIMENTO DE GALPŐES LOGÍSTICOS FEEDER INSTITUCIONAL FII RESP LIMITADA;FII SPXL;SPXL;
SPX REAL ESTATE DESENVOLVIMENTO DE GALPŐES LOGÍSTICOS FEEDER PRIVATE FII RESPONSABILIDADE LIMITADA;FII SPXG;SPXG;
SPX REAL ESTATE MULTIESTRATÉGIA FUNDO DE INVESTIMENTO IMOBILIÁRIO RESPONSABILIDADE LIMITADA;FII SPX SYN;SPXS;
SPX RENDA IMOBILIÁRIA III FUNDO DE INVESTIMENTO IMOBILIÁRIO RESPONSABILIDADE LIMITADA;FII SPXT;SPXT;
STARX FUNDO DE INVESTIMENTO IMOBILIÁRIO FII RESPONSABILIDADE LIMITADA;FII STARX;STRX;
STRIVO YIELD FUNDO DE INVESTIMENTO IMOBILIÁRIO RESPONSABILIDADE LIMITADA;FII STYI;STYI;
SULAMÉRICA REAL ESTATE FUNDO DE INVESTIMENTO IMOBILIÁRIO DE RESPONSABILIDADE LIMITADA;FII SURE;SURE;
SUNO ENERGIAS LIMPAS FUNDO DE INVESTIMENTO IMOBILIÁRIO IS RESPONSABILIDADE LIMITADA;FII SUNO EL;SNEL;
SUNO FUNDO DE FUNDOS DE INVESTIMENTO IMOBILIÁRIO FUNDO DE INVESTIMENTO IMOBILIÁRIO RESPONSABILIDADE;FII SUNOFOFI;SNFF;
SUNO LOG FUNDO DE INVESTIMENTO IMOBILIÁRIO - RESPONSABILIDADE LIMITADA;FII SUNO LG;SNLG;
SUNO MULTIESTRATÉGIA FUNDO DE INVESTIMENTO IMOBILIÁRIO RESPONSABILIDADE LIMITADA;FII SNME;SNME;
SUNO RECEBÍVEIS IMOBILIÁRIOS FUNDO DE INVESTIMENTO IMOBILIÁRIO RESPONSABILIDADE LIMITADA;FII SUNO CRI;SNCI;
SUPREMO FUNDO DE INVESTIMENTO IMOBILIÁRIO;FII SUPREMO;SPMO;
TELLUS DESENVOLVIMENTO LOGÍSTICO - FUNDO DE INVESTIMENTO IMOBILIÁRIO RESPONSABILIDADE LIMITADA;FII TELLUS;TELD;
TELLUS MULTIESTRATÉGIA - FII FUNDO DE INVESTIMENTO IMOBILIÁRIO RESPONSABILIDADE LIMITADA;FII TELM;TELM;
TELLUS PROPERTIES - FUNDO DE INVESTIMENTO IMOBILIÁRIO - RESPONSABILIDADE LIMITADA;FII TEL PROP;TEPP;
TELLUS RIO BRAVO RENDA LOGÍSTICA FUNDO DE INVESTIMENTO IMOBILIÁRIO DE RESPONSABILIDADE LIMITADA;FII SDI LOG;TRBL;
TEN DESENVOLVIMENTO FUNDO DE INVESTIMENTO IMOBILIÁRIO RESPONSABILIDADE LIMITADA;FII NAUI;NAUI;
TERRAS PAULISTAS FUNDO DE  INVESTIMENTO IMOBILIÁRIO DE PERMUTAS RESPONSABILIDADE LIMITADA;FII TRPL;TRPL;
TIVIO OPPORTUNITIES IPCA - FUNDO DE INVESTIMENTO IMOBILIÁRIO - RESPONSABILIDADE LIMITADA;FII TVOI;TVOI;
TIVIO OPPORTUNITIES MASTER FUNDO DE INVESTIMENTO IMOBILIÁRIO - RESPONSABILIDADE LIMITADA;FII TIOM;TIOM;
TIVIO RENDA IMOBILIÁRIA FUNDO DE INVESTIMENTO IMOBILIÁRIO RESPONSABILIDADE LIMITADA;FII TIVIO RI;TVRI;
TIVIO SECURITIES FUNDO DE INVESTIMENTO IMOBILIÁRIO RESPONSABILIDADE LIMITADA;FII V MASTER;VOTS;
TJK RENDA IMOBILIÁRIA FUNDO DE INVESTIMENTO IMOBILIÁRIO - RESPONSABILIDADE LIMITADA;FII TJK REND;TJKB;
TORDESILHAS EI FUNDO DE INVESTIMENTO IMOBILIÁRIO RESPONSABILIDADE LIMITADA;FII TORDE EI;TORD;
TRANSINC FUNDO DE INVESTIMENTO IMOBILIÁRIO RESPONSABILIDADE LIMITADA;FII TRANSINC;TSNC;
TREECORP REAL ESTATE FII - RESPONSABILIDADE LIMITADA;FII TREECORP;TCPF;
TRX HEDGE FUND FUNDO DE INVESTIMENTO IMOBILIÁRIO - RESPONSABILIDADE LIMITADA;FII TRXY;TRXY;
TRX REAL ESTATE FUNDO DE INVESTIMENTO IMOBILIÁRIO RESPONSABILIDADE LIMITADA;FII TRX REAL;TRXF;
TRX REAL ESTATE II FUNDO DE INVESTIMENTO IMOBILIÁRIO - RESPONSABILIDADE LIMITADA;FII TRX R II;TRXB;
TZDK FUNDO DE INVESTIMENTO IMOBILIÁRIORESPONSABILIDADE LIMITADA;FII MOGNO HT;MGHT;
URCA HEDGE FUND ESTRATÉGIA IMOBILIÁRIA FUNDO DE INVESTIMENTO IMOBILIÁRIO - RESPONSABILIDADE LIMITADA;FII URHF;URHF;
URCA PRIME RENDA FUNDO DE INVESTIMENTO IMOBILIÁRIO - FII;FII URCA REN;URPR;
V2 EDIFÍCIOS CORPORATIVOS FUNDO DE INVESTIMENTO IMOBILIÁRIO RESPONSABILIDADE LIMITADA;FII V2EDCORP;VVCO;
V2 MULTI RENDA FUNDO DE INVESTIMENTO IMOBILIÁRIO RESPONSABILIDADE LIMITADA;FII MULT REN;VVMR;
V2 PRIME PROPERTIES FUNDO DE INVESTIMENTO IMOBILIÁRIO - FII - RESPONSABILIDADE LIMITADA;FII V2 PRIME;VPPR;
V2 RECEBÍVEIS IMOBILIÁRIOS FUNDO DE INVESTIMENTO IMOBILIÁRIO RESPONSABILIDADE LIMITADA;FII V2 RECE;VVCR;
V2 RENDA IMOBILIÁRIA FUNDO DE INVESTIMENTO IMOBILIÁRIO RESPONSABILIDADE LIMITADA;FII V2 RENDA;VVRI;
VALORA CRI CDI FLUXO MENSAL MARÇO 26 FEEDER FUNDO DE INVESTIMENTO IMOBILIÁRIO RESPONSABILIDADE LIMIT;FII VGRM;VGRM;
VALORA CRI CDI FUNDO DE INVESTIMENTO IMOBILIÁRIO - FII RESPONSABILIDADE LIMITADA;FII VALREIII;VGIR;
VALORA CRI ÍNDICE DE PREÇO FUNDO DE INVESTIMENTO IMOBILIÁRIO - FII RESPONSABILIDADE LIMITADA;FII VALORAIP;VGIP;
VALORA CRI INFRA II FUNDO DE INVESTIMENTO IMOBILIÁRIO DE RESPONSABILIDADE LIMITADA;FII VGII;VGII;
VALORA HEDGE FUND FUNDO DE INVESTIMENTO IMOBILIÁRIO DE RESPONSABILIDADE LIMITADA;FII VALOR HE;VGHF;
VALORA RENDA IMOBILIÁRIA FUNDO DE  INVESTIMENTO IMOBILIÁRIO RESPONSABILIDADE LIMITADA;FII VGRI;VGRI;
VBI OFFICE FUND II - FUNDO DE INVESTIMENTO IMOBILIÁRIO - RESPONSABILIDADE  LIMITADA;FII BLMO VBI;BLMO;
VECTIS JUROS REAL FUNDO DE INVESTIMENTO IMOBILIÁRIO RESPONSABILIDADE LIMITADA;FII VECTIS;VCJR;
VECTOR QUELUZ LAJES CORPORATIVAS FUNDO DE INVESTIMENTO IMOBILIARIO;FII VQ LAJES;VLJS;
VENUS 11 FUNDO DE INVESTIMENTO EM COTAS DE FUNDO DE INVESTIMENTO IMOBILIÁRIO RESPONSABILIDADE LIMITA;FII VNSS;VNSS;
VĘNUS FUNDO DE INVESTIMENTO IMOBILIÁRIO RESPONSABILIDADE LIMITADA;FII VENUS;SALI;
VERA CRUZ THREE FUNDO DE INVESTIMENTO IMOBILIÁRIO RESPONSABILIDADE LIMITADA;FII VCTH;VCTH;
VERSALHES RECEBÍVEIS IMOBILIÁRIOS FUNDO DE INVESTIMENTO IMOBILIÁRIO DE RESPONSABILIDADE LIMITADA;FII VERS CRI;VSLH;
VIA PARQUE SHOPPING FUNDO DE INVESTIMENTO IMOBILIÁRIO DE RESPONSABILIDADE LIMITADA;FII V PARQUE;FVPQ;
VIC DESENVOLVIMENTO - VINTAGE 20/21 FUNDO DE INVESTIMENTO IMOBILIÁRIO - RESPONSABILIDADE LIMITADA;FII VIC DES;VIDS;
VIC DESENVOLVIMENTO VINTAGE 22/23 FUNDO DE INVESTIMENTO IMOBILIÁRIO;FII VIC VIN;VDSV;
VINCI CREDIT SECURITIES FUNDO DE INVESTIMENTO IMOBILIÁRIO - RESPONSABILIDADE LIMITADA;FII VINCI CR;VCRI;
VINCI IMÓVEIS URBANOS FUNDO DE INVESTIMENTO IMOBILIÁRIO - RESPONSABILIDADE  LIMITADA;FII VINCI IU;VIUR;
VINCI LOGÍSTICA FUNDO DE INVESTIMENTO IMOBILIÁRIO - RESPONSABILIDADE LIMITADA;FII VINCI LG;VILG;
VINCI MOZAK RESIDENCIAL II FUNDO DE INVESTIMENTO IMOBILIÁRIO - RESPONSABILIDADE LIMITADA;FII VIMO;VIMO;
VINCI OFFICES FUNDO DE INVESTIMENTO IMOBILIÁRIO - RESPONSABILIDADE LIMITADA;FII VINCI OF;VINO;
VINCI OPORTUNIDADES LOGÍSTICAS FII RESPONSABILIDADE LIMITADA;FII VIOL;VIOL;
VINCI SHOPPING CENTERS FUNDO DE INVESTIMENTO IMOBILIÁRIO - RESPONSABILIDADE LIMITADA;FII VINCI SC;VISC;
WHG FINVEST SP REALTY FUNDO DE INVESTIMENTO IMOBILIÁRIO - RESPONSABILIDADE LIMITADA;FII WHG F SP;SPDE;
WHG REAL ESTATE FUNDO DE INVESTIMENTO IMOBILIÁRIO - FII RESPONSABILIDADE LIMITADA;FII WHG REAL;WHGR;
XLPR FUNDO DE INVESTIMENTO IMOBILIÁRIO - FII - RESPONSABILIDADE LIMITADA;FII XLPR RI;XLPR;
XP CORPORATE MACAÉ FUNDO DE INVESTIMENTO IMOBILIÁRIO DE RESPONSABILIDADE LIMITADA;FII XP MACAE;XPCM;
XP CRÉDITO IMOBILIÁRIO - FUNDO DE INVESTIMENTO IMOBILIÁRIO;FII XP CRED;XPCI;
XP LOG FUNDO DE INVESTIMENTO IMOBILIÁRIO RESPONSABILIDADE LIMITADA - FII;FII XP LOG;XPLG;
XP MALLS FUNDO DE INVESTIMENTO IMOBILIÁRIO FII;FII XP MALLS;XPML;
XP SELECTION FUNDO DE FUNDOS DE INVESTIMENTO IMOBILIÁRIO - FII;FII XP SELEC;XPSF;
YUCA FUNDO DE INVESTIMENTO IMOBILIÁRIO RESPONSABILIDADE LIMITADA;FII YUCA;YUFI;
ZAGROS MULTIESTRATÉGIA FUNDO DE INVESTIMENTO IMOBILIÁRIO RESPONSABILIDADE LIMITADA;FII ZAGH;ZAGH;
ZAGROS RENDA IMOBILIÁRIA FUNDO DE INVESTIMENTO IMOBILIÁRIO RESPONSABILIDADE LIMITADA;FII GGR ZAG;GGRC;
ZAVIT CRÉDITO IMOBILIÁRIO FUNDO DE INVESTIMENTO IMOBILIÁRIO - RESPONSABILIDADE LIMITADA;FII ZAVIT C;ZAVC;
ZAVIT REAL ESTATE FUND - FUNDO DE INVESTIMENTO IMOBILIÁRIO - RESPONSABILIDADE LIMITADA;FII ZAVIT R;ZAVI;
ZION CAPITAL FUNDO DE INVESTIMENTO IMOBILIÁRIO - FII RESPONSABILIDADE LIMITADA;FII ZION;ZIFI;
